year,month,month_str,day,category,match,place
819.0,,,,birth, ولد سنة تسع عشرة وثمانمائة بالقاهرة,القاهرة
38.0,,,,istaqara, برع في الكتابة والحساب وما يلتحق به وتكلم في اقطاع الناصري محمد بن الاشرف برسباي ثم استقر به الاشرف سنة ثمان وثلاثين,
41.0,3.0,ربيع الاول,,death, ولزم من ذلك اخذ مال كثير منه ومن اخيه ولزم الجمالي بيته الى ان مات اخوه فولاه الاشرف في ربيع الاول سنة احدى واربعين,
,,,20.0,, نظرا لخاص فباشرها نحو اثنتين وعشرين سنة,
56.0,3.0,ربيع الاول,,, الكمالي بن البارزي على ابنته واستمر في مزيد الترقي واضيف اليه نظر الجيش عوضا عن المحيي بن الاشقر في ربيع الاول سنة ست وخمسين بل,ل
62.0,12.0,ذي الحجة,18.0,death, وانجح واسعده الله في خاصته وجماعته وذكر غير هذا متعذرا واستمر على ترقيه ووجاهته حتى مات وقت التسبيح من ثامن عشر ذي الحجة سنة اثنتين وستين,
