year,month,month_str,day,category,match,place
725.0,,,,birth, ولد في سنة خمس وعشرين وسبعمائة,
60.0,,,,samia, مغلطاي والعز بن جماعة وحدث عن اولهما بالسيرة النبوية والدر المنظوم من كلام المعصوم وذكر انه سمع الاولى منه سنة ستين,
800.0,4.0,ربيع الاخر,,death, الظاهر برقوق على البريد لما مات الشمس الطرابلسي وقال حينئذ انا الان ابن خمس وسبعين فحضر من حلب في ربيع الاخر سنة ثمانمائة,
1.0,,,,death, من الحيل في اكل الربا وانه كان يقول من نظر في كتاب البخاري تزندق ومع ذلك فلما مات الكلستاني في سنة احدى,
,,,30.0,, فلوسا لا يخل بذلك ولم يكن يقطع زكاة ماله مع بعض شح وطمع وتغفيل وانه اقام بحلب قريبا من ثلاثين سنة,
83.0,,,,qaraa, مالا كثيرا فنهب اكثره في اللنكية قال وهو احد مشايخي قرات عليه من كتاب البزدوي مجالس متعددة في حلب سنة ثلاث وثمانين,
3.0,4.0,ربيع الاخر,18.0,death, مات في ثامن عشر ربيع الاخر سنة ثلاث,
