year,month,month_str,day,category,match,place
725,,,,birth, ولد في اول سنة خمس وعشرين وسبعمائة,
782,,,,, بها اياما حتى ولي غيره فعاد وقد اشار الى اصل ذلك القاضي تقي الدين الزبيري فانه قال في حوادث سنة اثنتين وثمانين وسبعمائة,
2,1.0,محرم,8.0,death, وقد حج كثيرا وجاور مرة وحدث هناك واقرا ثم رجع فمات في الطريق في يوم الاربعاء ثامن المحرم سنة اثنتين بمنزلة,منزلة
736,12.0,ذي الحجة,,death, واصل القبة لبهادر الجمالي الناصري امير الحج كما قراته على لوح قبره وانه مات في رجوعه من الحج في ذي الحجة سنة ست وثلاثين وسبعمائة,
749,,,,, وكذا حكى لي العز السنباطي عن شيخه الشمس البوصيري ان الابناسي خرج في بعض ليالي طاعون سنة تسع واربعين وسبعمائة,
