year,month,month_str,day,category,match,place
756,,,,birth, ولد سنة ست وخمسين وسبعمائة,
27,,,,, قال العيني الكبار بسمرقند وشيراز وهراة وغيرها ولازم السيد الجرجاني مدة زاد غيره والسعد التفتازاني وقدم الديار المصرية في سنة سبع وعشرين,
29,4,ربيع الاخر,,death, لبعض من مات من صوفيتها ولامور فاحشة نقلت له عنه وامر باخراجه وقرر فيها شيخنا ابن الهمام وذلك في ربيع الاخر سنة تسع وعشرين,
34,,,,, وتوجه هذا فحج وسافر من هناك الى الروم ثم عاد الى مصر في سنة اربع وثلاثين,
34,9,رمضان,,, وحضر مجلس الحديث بالقلعة في رمضان سنة اربع وثلاثين,
39,End of,اخر,,, ورام من السلطان امرا فلم يصل اليه فتوجه في اخرها الى بلاد الروم في البحر ثم عاد في اثناء سنة تسع وثلاثين,
40,,,,, الحاضرون وليس بمدفوع عن العلم والاستعداد ولكنه يحب الشهرة ورام الاستقرار في مشيخة الشيخونية فلم يتهيا له فلما كان سنة اربعين,
41,End of,اخر,,death, العافية واراد دخول الحمام فسقط من سريره فانفك وركه فانقطع مدة اخرى الى ان مات والله يعفو عنه في سنة احدى واربعين,
