year,month,month_str,day,category,match,place
742.0,,,,birth, ولد سنة اثنتين واربعين وسبعمائة,
90.0,,,,samia, ابي عمر بن جماعة فكان مما سمعه عليه صحيح ابن حبان وناب في الحكم بل عمل امين الحكم في سنة تسعين,
41.0,,,,birth, هذا حاصل ما ترجمه به التقى عبد الرحمن القلقشندي وعين غيره مولده في اول سنة احدى واربعين,
42.0,,,,birth, ينسب لفضيلة ومشاركة واما شيخنا فلم يزد في نسبه على محمد الثالث وقال انه كتب بخطه ان مولده في سنة اثنتين واربعين,
90.0,,,,, ويذاكر به بعد ان شاخ وله اشتغال كثير ومعرفة تامة بالفرائض ثم تعانى الخدم بالشهادة وولي امانة الحكم في سنة تسعين,
,,,30.0,, فاستمر فيها اكثر من ثلاثين سنة,
24.0,,,,, وضعف بصره في سنة اربع وعشرين,
,,,30.0,, وكاد ان يكف ثم كف في التي بعدها وعاش الى ثلاثين سنة,
